{
  "slide_id": "Slide34",
  "model": "OpenGVLab/InternVL3-14B",
  "prompt": "triples",
  "raw_output": "```json\n{\n  \"triples\": [\n    {\n      \"s\": \"Demis Hassabis\",\n      \"p\": \"represents\",\n      \"o\": \"DeepMind\",\n      \"modalities\": [\"text\"],\n      \"confidence\": 1.0,\n      \"evidence\": \"Demis Hassabis, the co-founder and CEO of DeepMind\"\n    },\n    {\n      \"s\": \"DeepMind\",\n      \"p\": \"acquired by\",\n      \"o\": \"Google\",\n      \"modalities\": [\"text\"],\n      \"confidence\": 1.0,\n      \"evidence\": \"one of the worldâ€™s leading AI companies, later acquired by Google\"\n    },\n    {\n      \"s\": \"AI\",\n      \"p\": \"impacts\",\n      \"o\": \"science\",\n      \"modalities\": [\"text\"],\n      \"confidence\": 1.0,\n      \"evidence\": \"ready to impact science, healthcare, and our understanding of the human mind\"\n    },\n    {\n      \"s\": \"AI\",\n      \"p\": \"impacts\",\n      \"o\": \"healthcare\",\n      \"modalities\": [\"text\"],\n      \"confidence\": 1.0,\n      \"evidence\": \"ready to",
  "parsed": {
    "s": "AI",
    "p": "impacts",
    "o": "science",
    "modalities": [
      "text"
    ],
    "confidence": 1.0,
    "evidence": [
      "ready to impact science, healthcare, and our understanding of the human mind"
    ]
  }
}