{
  "slide_id": "Slide44",
  "model": "OpenGVLab/InternVL3-14B",
  "prompt": "triples",
  "raw_output": "```json\n{\n  \"triples\": [\n    {\n      \"s\": \"MATLAB\",\n      \"p\": \"uses\",\n      \"o\": \"Machine Learning Toolbox\",\n      \"modalities\": [\"text\"],\n      \"confidence\": 1.0,\n      \"evidence\": \"MATLAB now offers a Machine Learning Toolbox\"\n    },\n    {\n      \"s\": \"Machine Learning Toolbox\",\n      \"p\": \"produces\",\n      \"o\": \"parameter optimization\",\n      \"modalities\": [\"text\"],\n      \"confidence\": 1.0,\n      \"evidence\": \"helps you perform parameter optimization\"\n    },\n    {\n      \"s\": \"Machine Learning Toolbox\",\n      \"p\": \"produces\",\n      \"o\": \"data clustering\",\n      \"modalities\": [\"text\"],\n      \"confidence\": 1.0,\n      \"evidence\": \"helps you perform parameter optimization, data clustering\"\n    },\n    {\n      \"s\": \"Machine Learning Toolbox\",\n      \"p\": \"produces\",\n      \"o\": \"pattern recognition\",\n      \"modalities\": [\"text\"],\n      \"confidence\": 1.0,\n      \"evidence\": \"helps you perform parameter optimization, data clustering, and pattern recognition\"",
  "parsed": {
    "s": "Machine Learning Toolbox",
    "p": "produces",
    "o": "data clustering",
    "modalities": [
      "text"
    ],
    "confidence": 1.0,
    "evidence": [
      "helps you perform parameter optimization, data clustering"
    ]
  }
}