{
  "slide_id": "Slide29",
  "model": "OpenGVLab/InternVL3-14B",
  "prompt": "triples",
  "raw_output": "```json\n{\n  \"triples\": [\n    {\n      \"s\": \"op amp\",\n      \"p\": \"uses\",\n      \"o\": \"Kirchhoff’s Current Law\",\n      \"modalities\": [\"text\"],\n      \"confidence\": 1.0,\n      \"evidence\": \"Even though an operational amplifier is an active component, the basic circuit laws still apply — Kirchhoff’s Current Law and Kirchhoff’s Voltage Law always hold.\"\n    },\n    {\n      \"s\": \"op amp\",\n      \"p\": \"uses\",\n      \"o\": \"Kirchhoff’s Voltage Law\",\n      \"modalities\": [\"text\"],\n      \"confidence\": 1.0,\n      \"evidence\": \"Even though an operational amplifier is an active component, the basic circuit laws still apply — Kirchhoff’s Current Law and Kirchhoff’s Voltage Law always hold.\"\n    },\n    {\n      \"s\": \"op amp\",\n      \"p\": \"represents\",\n      \"o\": \"two input terminals at the same voltage\",\n      \"modalities\": [\"text\"],\n      \"confidence\": 1.0,\n      \"evidence\": \"Rule one: The two input terminals are at the same voltage.\"\n    },\n    {",
  "parsed": {
    "s": "op amp",
    "p": "represents",
    "o": "two input terminals at the same voltage",
    "modalities": [
      "text"
    ],
    "confidence": 1.0,
    "evidence": [
      "Rule one: The two input terminals are at the same voltage."
    ]
  }
}