{
  "slide_id": "Slide15",
  "model": "OpenGVLab/InternVL3-14B",
  "prompt": "triples",
  "raw_output": "```json\n{\n  \"triples\": [\n    {\n      \"s\": \"Example 1: Parallel beam\",\n      \"p\": \"uses\",\n      \"o\": \"Ex1_parallel.m\",\n      \"modalities\": [\"text\"],\n      \"confidence\": 1.0,\n      \"evidence\": \"Run Ex1_parallel.m\"\n    },\n    {\n      \"s\": \"theta (red arrow)\",\n      \"p\": \"represents\",\n      \"o\": \"projection angle\",\n      \"modalities\": [\"text\"],\n      \"confidence\": 1.0,\n      \"evidence\": \"As θ (red arrow) is changing, information is added to the sinogram!\"\n    },\n    {\n      \"s\": \"sinogram\",\n      \"p\": \"produces\",\n      \"o\": \"information\",\n      \"modalities\": [\"text\"],\n      \"confidence\": 1.0,\n      \"evidence\": \"As θ (red arrow) is changing, information is added to the sinogram!\"\n    },\n    {\n      \"s\": \"p_type (Line 5)\",\n      \"p\": \"depends_on\",\n      \"o\": \"sample types\",\n      \"modalities\": [\"text\"],\n      \"confidence\": 1.",
  "parsed": {
    "s": "sinogram",
    "p": "produces",
    "o": "information",
    "modalities": [
      "text"
    ],
    "confidence": 1.0,
    "evidence": [
      "As θ (red arrow) is changing, information is added to the sinogram!"
    ]
  }
}