{
  "slide_id": "Slide12",
  "model": "OpenGVLab/InternVL3-14B",
  "prompt": "triples",
  "raw_output": "```json\n{\n  \"triples\": [\n    {\n      \"s\": \"Medical X-rays\",\n      \"p\": \"uses\",\n      \"o\": \"ionizing radiation\",\n      \"modalities\": [\"text\"],\n      \"confidence\": 1.0,\n      \"evidence\": \"Ionizing Radiation\"\n    },\n    {\n      \"s\": \"Medical X-rays\",\n      \"p\": \"measures\",\n      \"o\": \"high geometric accuracy\",\n      \"modalities\": [\"text\"],\n      \"confidence\": 1.0,\n      \"evidence\": \"High Geometric Accuracy\"\n    },\n    {\n      \"s\": \"Medical X-rays\",\n      \"p\": \"measures\",\n      \"o\": \"sensitive & specific for many diseases\",\n      \"modalities\": [\"text\"],\n      \"confidence\": 1.0,\n      \"evidence\": \"Sensitive &/ Specific for Many Diseases\"\n    },\n    {\n      \"s\": \"Medical X-rays\",\n      \"p\": \"measures\",\n      \"o\": \"poor contrast in soft tissue\",\n      \"modalities\": [\"text\"],\n      \"confidence\": 1.0,\n      \"evidence\": \"Poor Contrast in Soft Tissue\"\n    },\n    {\n      \"",
  "parsed": {
    "s": "Medical X-rays",
    "p": "measures",
    "o": "poor contrast in soft tissue",
    "modalities": [
      "text"
    ],
    "confidence": 1.0,
    "evidence": [
      "Poor Contrast in Soft Tissue"
    ]
  }
}