{
  "slide_id": "Slide45",
  "model": "OpenGVLab/InternVL3-14B",
  "prompt": "triples",
  "raw_output": "```json\n{\n  \"triples\": [\n    {\n      \"s\": \"Image Processing Toolbox\",\n      \"p\": \"uses\",\n      \"o\": \"loading, modifying, analyzing, and segmenting images\",\n      \"modalities\": [\"text\"],\n      \"confidence\": 1.0,\n      \"evidence\": \"It includes powerful tools for loading, modifying, analyzing, and segmenting images.\"\n    },\n    {\n      \"s\": \"Image Processing Toolbox\",\n      \"p\": \"uses\",\n      \"o\": \"sharpening edges, enhancing contrast, isolating bright regions\",\n      \"modalities\": [\"text\"],\n      \"confidence\": 1.0,\n      \"evidence\": \"You can sharpen edges, enhance contrast, or isolate bright regions.\"\n    },\n    {\n      \"s\": \"Image Processing Toolbox\",\n      \"p\": \"uses\",\n      \"o\": \"analyzing object shapes and intensities\",\n      \"modalities\": [\"text\"],\n      \"confidence\": 1.0,\n      \"evidence\": \"It even lets you analyze object shapes and intensities.\"\n    },\n    {\n      \"s\": \"Image Processing Toolbox\",\n      \"p\": \"uses\",\n      \"o\": \"registering images, aligning",
  "parsed": {
    "s": "Image Processing Toolbox",
    "p": "uses",
    "o": "analyzing object shapes and intensities",
    "modalities": [
      "text"
    ],
    "confidence": 1.0,
    "evidence": [
      "It even lets you analyze object shapes and intensities."
    ]
  }
}