{
  "slide_id": "Slide47",
  "model": "OpenGVLab/InternVL3-14B",
  "prompt": "triples",
  "raw_output": "```json\n{\n  \"triples\": [\n    {\n      \"s\": \"Optimization Toolbox\",\n      \"p\": \"uses\",\n      \"o\": \"solving problems\",\n      \"modalities\": [\"text\"],\n      \"confidence\": 1.0,\n      \"evidence\": \"This oneâ€™s all about solving problems where you want to find the best outcome\"\n    },\n    {\n      \"s\": \"Optimization Toolbox\",\n      \"p\": \"uses\",\n      \"o\": \"minimizing cost\",\n      \"modalities\": [\"text\"],\n      \"confidence\": 1.0,\n      \"evidence\": \"like minimizing cost\"\n    },\n    {\n      \"s\": \"Optimization Toolbox\",\n      \"p\": \"uses\",\n      \"o\": \"maximizing performance\",\n      \"modalities\": [\"text\"],\n      \"confidence\": 1.0,\n      \"evidence\": \"or maximizing performance\"\n    },\n    {\n      \"s\": \"Optimization Toolbox\",\n      \"p\": \"uses\",\n      \"o\": \"linear programs\",\n      \"modalities\": [\"text\"],\n      \"confidence\": 1.0,\n      \"evidence\": \"You can solve linear programs\"\n    },\n    {\n      \"s\": \"",
  "parsed": {
    "s": "Optimization Toolbox",
    "p": "uses",
    "o": "linear programs",
    "modalities": [
      "text"
    ],
    "confidence": 1.0,
    "evidence": [
      "You can solve linear programs"
    ]
  }
}