{
  "slide_id": "Slide24",
  "model": "OpenGVLab/InternVL3-14B",
  "prompt": "triples",
  "raw_output": "```json\n{\n  \"triples\": [\n    {\n      \"s\": \"MATLAB plots\",\n      \"p\": \"uses\",\n      \"o\": \"grouped bar charts\",\n      \"modalities\": [\"text\", \"image\"],\n      \"confidence\": 1.0,\n      \"evidence\": \"Here are a few examples of what you can do with MATLAB plots.\"\n    },\n    {\n      \"s\": \"MATLAB plots\",\n      \"p\": \"uses\",\n      \"o\": \"stacked bars\",\n      \"modalities\": [\"text\", \"image\"],\n      \"confidence\": 1.0,\n      \"evidence\": \"You’ll see grouped bar charts, stacked bars, 2D lines, and 3D surfaces — all using basic commands.\"\n    },\n    {\n      \"s\": \"MATLAB plots\",\n      \"p\": \"uses\",\n      \"o\": \"2D lines\",\n      \"modalities\": [\"text\", \"image\"],\n      \"confidence\": 1.0,\n      \"evidence\": \"You’ll see grouped bar charts, stacked bars, 2D lines, and 3D surfaces — all using basic commands.\"\n    },\n    {\n      \"s\": \"MATLAB plots\",\n      \"p",
  "parsed": {
    "s": "MATLAB plots",
    "p": "uses",
    "o": "2D lines",
    "modalities": [
      "text",
      "image"
    ],
    "confidence": 1.0,
    "evidence": [
      "You’ll see grouped bar charts, stacked bars, 2D lines, and 3D surfaces - all using basic commands."
    ]
  }
}