{
  "slide_id": "Slide11",
  "model": "OpenGVLab/InternVL3-14B",
  "prompt": "triples",
  "raw_output": "```json\n{\n  \"triples\": [\n    {\n      \"s\": \"%\",\n      \"p\": \"represents\",\n      \"o\": \"comment\",\n      \"modalities\": [\"text\"],\n      \"confidence\": 1.0,\n      \"evidence\": \"The percent symbol — % — is used for writing comments.\"\n    },\n    {\n      \"s\": \";\",\n      \"p\": \"suppresses\",\n      \"o\": \"display of value\",\n      \"modalities\": [\"text\"],\n      \"confidence\": 1.0,\n      \"evidence\": \"A semicolon — ; — tells MATLAB not to display the output of a command\"\n    },\n    {\n      \"s\": \"...\",\n      \"p\": \"continues\",\n      \"o\": \"statement on next line\",\n      \"modalities\": [\"text\"],\n      \"confidence\": 1.0,\n      \"evidence\": \"If a command is getting too long, you can break it across multiple lines using three dots — ....\"\n    },\n    {\n      \"s\": \"eps\",\n      \"p\": \"represents\",\n      \"o\": \"machine epsilon\",\n      \"modalities\": [\"text\"],\n      \"confidence\": 1.0,\n      \"evidence\":",
  "parsed": {
    "s": "...",
    "p": "continues",
    "o": "statement on next line",
    "modalities": [
      "text"
    ],
    "confidence": 1.0,
    "evidence": [
      "If a command is getting too long, you can break it across multiple lines using three dots - ...."
    ]
  }
}