{
  "slide_id": "Slide5",
  "model": "OpenGVLab/InternVL3-14B",
  "prompt": "triples",
  "raw_output": "```json\n{\n  \"triples\": [\n    {\n      \"s\": \"Octave\",\n      \"p\": \"represents\",\n      \"o\": \"scientific programming language\",\n      \"modalities\": [\"text\"],\n      \"confidence\": 1.0,\n      \"evidence\": \"Octave is a scientific programming language that mirrors MATLAB’s syntax and functionality.\"\n    },\n    {\n      \"s\": \"Octave\",\n      \"p\": \"uses\",\n      \"o\": \"MATLAB’s syntax and functionality\",\n      \"modalities\": [\"text\"],\n      \"confidence\": 1.0,\n      \"evidence\": \"Octave is a scientific programming language that mirrors MATLAB’s syntax and functionality.\"\n    },\n    {\n      \"s\": \"Octave\",\n      \"p\": \"depends_on\",\n      \"o\": \"basic matrix operations, plotting, and simple scripts\",\n      \"modalities\": [\"text\"],\n      \"confidence\": 1.0,\n      \"evidence\": \"under the hood, many of the same commands will work — especially those used for basic matrix operations, plotting, and simple scripts.\"\n    },\n    {\n      \"s\": \"Octave\",\n      \"p\": \"produces\",\n      \"o\": \"foundational skills",
  "parsed": {
    "s": "Octave",
    "p": "depends_on",
    "o": "basic matrix operations, plotting, and simple scripts",
    "modalities": [
      "text"
    ],
    "confidence": 1.0,
    "evidence": [
      "under the hood, many of the same commands will work - especially those used for basic matrix operations, plotting, and simple scripts."
    ]
  }
}