{
  "slide_id": "Slide21",
  "model": "OpenGVLab/InternVL3-14B",
  "prompt": "triples",
  "raw_output": "```json\n{\n  \"triples\": [\n    {\n      \"s\": \"MATLAB\",\n      \"p\": \"uses\",\n      \"o\": \"linspace\",\n      \"modalities\": [\"text\"],\n      \"confidence\": 1.0,\n      \"evidence\": \"Start by generating x values from minus one to one using linspace.\"\n    },\n    {\n      \"s\": \"MATLAB\",\n      \"p\": \"uses\",\n      \"o\": \"plot\",\n      \"modalities\": [\"text\"],\n      \"confidence\": 1.0,\n      \"evidence\": \"Use plot x and y to create a basic line graph.\"\n    },\n    {\n      \"s\": \"MATLAB\",\n      \"p\": \"uses\",\n      \"o\": \"hold on\",\n      \"modalities\": [\"text\"],\n      \"confidence\": 1.0,\n      \"evidence\": \"Use hold on if you want to overlay another plot on the same figure.\"\n    },\n    {\n      \"s\": \"MATLAB\",\n      \"p\": \"uses\",\n      \"o\": \"figure\",\n      \"modalities\": [\"text\"],\n      \"confidence\": 1.0,\n      \"evidence\": \"Use figure to open a new figure window for a",
  "parsed": {
    "s": "MATLAB",
    "p": "uses",
    "o": "hold on",
    "modalities": [
      "text"
    ],
    "confidence": 1.0,
    "evidence": [
      "Use hold on if you want to overlay another plot on the same figure."
    ]
  }
}