{
  "slide_id": "Slide46",
  "model": "OpenGVLab/InternVL3-14B",
  "prompt": "triples",
  "raw_output": "```json\n{\n  \"triples\": [\n    {\n      \"s\": \"Instrument Control Toolbox\",\n      \"p\": \"uses\",\n      \"o\": \"MATLAB\",\n      \"modalities\": [\"text\"],\n      \"confidence\": 1.0,\n      \"evidence\": \"This toolbox allows MATLAB to talk directly to hardware\"\n    },\n    {\n      \"s\": \"Instrument Control Toolbox\",\n      \"p\": \"measures\",\n      \"o\": \"oscilloscopes, sensors, or signal generators\",\n      \"modalities\": [\"text\"],\n      \"confidence\": 1.0,\n      \"evidence\": \"This toolbox allows MATLAB to talk directly to hardware â€” like oscilloscopes, sensors, or signal generators\"\n    },\n    {\n      \"s\": \"Instrument Control Toolbox\",\n      \"p\": \"produces\",\n      \"o\": \"commands, receive data, and even control external devices\",\n      \"modalities\": [\"text\"],\n      \"confidence\": 1.0,\n      \"evidence\": \"you can send commands, receive data, and even control external devices\"\n    },\n    {\n      \"s\": \"Instrument Control Toolbox\",\n      \"p\": \"uses\",\n      \"o\": \"VISA or TCP/IP\",",
  "parsed": {
    "s": "Instrument Control Toolbox",
    "p": "produces",
    "o": "commands, receive data, and even control external devices",
    "modalities": [
      "text"
    ],
    "confidence": 1.0,
    "evidence": [
      "you can send commands, receive data, and even control external devices"
    ]
  }
}