{
  "slide_id": "Slide48",
  "model": "OpenGVLab/InternVL3-14B",
  "prompt": "triples",
  "raw_output": "```json\n{\n  \"triples\": [\n    {\n      \"s\": \"Statistics and Machine Learning Toolbox\",\n      \"p\": \"uses\",\n      \"o\": \"clustering\",\n      \"modalities\": [\"text\"],\n      \"confidence\": 1.0,\n      \"evidence\": \"You can use it for clustering\"\n    },\n    {\n      \"s\": \"Statistics and Machine Learning Toolbox\",\n      \"p\": \"uses\",\n      \"o\": \"regression\",\n      \"modalities\": [\"text\"],\n      \"confidence\": 1.0,\n      \"evidence\": \"You can use it for clustering, regression, dimensionality reduction, or training classifiers\"\n    },\n    {\n      \"s\": \"Statistics and Machine Learning Toolbox\",\n      \"p\": \"uses\",\n      \"o\": \"dimensionality reduction\",\n      \"modalities\": [\"text\"],\n      \"confidence\": 1.0,\n      \"evidence\": \"You can use it for clustering, regression, dimensionality reduction, or training classifiers\"\n    },\n    {\n      \"s\": \"Statistics and Machine Learning Toolbox\",\n      \"p\": \"uses\",\n      \"o\": \"training classifiers\",\n      \"modalities\": [\"text\"],\n      \"confidence\": 1.0,",
  "parsed": {
    "s": "Statistics and Machine Learning Toolbox",
    "p": "uses",
    "o": "dimensionality reduction",
    "modalities": [
      "text"
    ],
    "confidence": 1.0,
    "evidence": [
      "You can use it for clustering, regression, dimensionality reduction, or training classifiers"
    ]
  }
}