{
  "slide_id": "Slide49",
  "model": "OpenGVLab/InternVL3-14B",
  "prompt": "triples",
  "raw_output": "```json\n{\n  \"triples\": [\n    {\n      \"s\": \"Symbolic Math Toolbox\",\n      \"p\": \"produces\",\n      \"o\": \"exact derivatives, integrals, or solutions to equations\",\n      \"modalities\": [\"text\"],\n      \"confidence\": 1.0,\n      \"evidence\": \"Instead of working with numbers alone, you can define symbolic variables and compute exact derivatives, integrals, or solutions to equations.\"\n    },\n    {\n      \"s\": \"Symbolic Math Toolbox\",\n      \"p\": \"uses\",\n      \"o\": \"symbolic variables\",\n      \"modalities\": [\"text\"],\n      \"confidence\": 1.0,\n      \"evidence\": \"Instead of working with numbers alone, you can define symbolic variables and compute exact derivatives, integrals, or solutions to equations.\"\n    },\n    {\n      \"s\": \"Symbolic Math Toolbox\",\n      \"p\": \"produces\",\n      \"o\": \"symbolic form\",\n      \"modalities\": [\"text\"],\n      \"confidence\": 1.0,\n      \"evidence\": \"You’ll get the answer in symbolic form — not an approximation.\"\n    },\n    {\n      \"s\": \"Symbolic Math Toolbox\",\n      \"p",
  "parsed": {
    "s": "Symbolic Math Toolbox",
    "p": "produces",
    "o": "symbolic form",
    "modalities": [
      "text"
    ],
    "confidence": 1.0,
    "evidence": [
      "You’ll get the answer in symbolic form - not an approximation."
    ]
  }
}