{
  "slide_id": "Slide30",
  "model": "OpenGVLab/InternVL3-14B",
  "prompt": "triples",
  "raw_output": "```json\n{\n  \"triples\": [\n    {\n      \"s\": \"MATLAB\",\n      \"p\": \"represents\",\n      \"o\": \"matrix\",\n      \"modalities\": [\"text\"],\n      \"confidence\": 1.0,\n      \"evidence\": \"One of the key ideas in MATLAB is that everything is a matrix.\"\n    },\n    {\n      \"s\": \"MATLAB\",\n      \"p\": \"uses\",\n      \"o\": \"indexing\",\n      \"modalities\": [\"text\"],\n      \"confidence\": 1.0,\n      \"evidence\": \"Now, let’s talk about indexing.\"\n    },\n    {\n      \"s\": \"MATLAB\",\n      \"p\": \"uses\",\n      \"o\": \"logical masks\",\n      \"modalities\": [\"text\"],\n      \"confidence\": 1.0,\n      \"evidence\": \"You can reshape matrices, slice out parts, or use logical masks to filter data.\"\n    },\n    {\n      \"s\": \"MATLAB\",\n      \"p\": \"uses\",\n      \"o\": \"element-by-element multiplication\",\n      \"modalities\": [\"text\"],\n      \"confidence\": 1.0,\n      \"evidence\": \"Or A dot star B — for",
  "parsed": {
    "s": "MATLAB",
    "p": "uses",
    "o": "logical masks",
    "modalities": [
      "text"
    ],
    "confidence": 1.0,
    "evidence": [
      "You can reshape matrices, slice out parts, or use logical masks to filter data."
    ]
  }
}