{
  "slide_id": "Slide8",
  "model": "OpenGVLab/InternVL3-14B",
  "prompt": "triples",
  "raw_output": "```json\n{\n  \"triples\": [\n    {\n      \"s\": \"MATLAB\",\n      \"p\": \"uses\",\n      \"o\": \"start menu or applications folder\",\n      \"modalities\": [\"text\"],\n      \"confidence\": 1.0,\n      \"evidence\": \"If you’re using Windows, just go to your start menu or applications folder and open MATLAB like any other program.\"\n    },\n    {\n      \"s\": \"MATLAB\",\n      \"p\": \"uses\",\n      \"o\": \"terminal\",\n      \"modalities\": [\"text\"],\n      \"confidence\": 1.0,\n      \"evidence\": \"On Linux, you’ll typically launch it from the terminal by typing matlab.\"\n    },\n    {\n      \"s\": \"MATLAB desktop\",\n      \"p\": \"represents\",\n      \"o\": \"main environment\",\n      \"modalities\": [\"text\"],\n      \"confidence\": 1.0,\n      \"evidence\": \"Once MATLAB starts, you’ll see what’s called the MATLAB desktop — this is the main environment where everything happens.\"\n    },\n    {\n      \"s\": \"MATLAB desktop\",\n      \"p\": \"contains\",\n      \"o\": \"command window\",\n      \"modalities\":",
  "parsed": {
    "s": "MATLAB desktop",
    "p": "represents",
    "o": "main environment",
    "modalities": [
      "text"
    ],
    "confidence": 1.0,
    "evidence": [
      "Once MATLAB starts, you’ll see what’s called the MATLAB desktop - this is the main environment where everything happens."
    ]
  }
}