{
  "slide_id": "Slide10",
  "model": "OpenGVLab/InternVL3-14B",
  "prompt": "triples",
  "raw_output": "```json\n{\n  \"triples\": [\n    {\n      \"s\": \"MATLAB\",\n      \"p\": \"uses\",\n      \"o\": \"workspace\",\n      \"modalities\": [\"text\"],\n      \"confidence\": 1.0,\n      \"evidence\": \"Once you start writing code in MATLAB, you’ll be creating and manipulating variables — and the workspace is used to hold them.\"\n    },\n    {\n      \"s\": \"MATLAB\",\n      \"p\": \"uses\",\n      \"o\": \"who command\",\n      \"modalities\": [\"text\"],\n      \"confidence\": 1.0,\n      \"evidence\": \"The who and whos commands show you what variables are currently stored.\"\n    },\n    {\n      \"s\": \"MATLAB\",\n      \"p\": \"uses\",\n      \"o\": \"whos command\",\n      \"modalities\": [\"text\"],\n      \"confidence\": 1.0,\n      \"evidence\": \"The who and whos commands show you what variables are currently stored.\"\n    },\n    {\n      \"s\": \"MATLAB\",\n      \"p\": \"uses\",\n      \"o\": \"save command\",\n      \"modalities\": [\"text\"],\n      \"confidence\": 1.0,",
  "parsed": {
    "s": "MATLAB",
    "p": "uses",
    "o": "whos command",
    "modalities": [
      "text"
    ],
    "confidence": 1.0,
    "evidence": [
      "The who and whos commands show you what variables are currently stored."
    ]
  }
}