{
  "slide_id": "Slide13",
  "model": "OpenGVLab/InternVL3-14B",
  "prompt": "triples",
  "raw_output": "```json\n{\n  \"triples\": [\n    {\n      \"s\": \"digital signals\",\n      \"p\": \"are\",\n      \"o\": \"exact\",\n      \"modalities\": [\"text\"],\n      \"confidence\": 1.0,\n      \"evidence\": \"First — digital signals are exact.\"\n    },\n    {\n      \"s\": \"digital systems\",\n      \"p\": \"can\",\n      \"o\": \"detect and correct errors\",\n      \"modalities\": [\"text\"],\n      \"confidence\": 1.0,\n      \"evidence\": \"Second — errors can be detected and corrected.\"\n    },\n    {\n      \"s\": \"digital systems\",\n      \"p\": \"can\",\n      \"o\": \"filter out noise and interference\",\n      \"modalities\": [\"text\"],\n      \"confidence\": 1.0,\n      \"evidence\": \"Third — noise and interference can be filtered out more easily.\"\n    },\n    {\n      \"s\": \"digital transmission\",\n      \"p\": \"allows\",\n      \"o\": \"multiple types of information over the same line\",\n      \"modalities\": [\"text\"],\n      \"confidence\": 1.0,\n      \"evidence\": \"Fourth — with digital transmission, we can send multiple",
  "parsed": {
    "s": "digital systems",
    "p": "can",
    "o": "filter out noise and interference",
    "modalities": [
      "text"
    ],
    "confidence": 1.0,
    "evidence": [
      "Third - noise and interference can be filtered out more easily."
    ]
  }
}