{
  "slide_id": "Slide5",
  "model": "OpenGVLab/InternVL3-14B",
  "prompt": "triples",
  "raw_output": "```json\n{\n  \"triples\": [\n    {\n      \"s\": \"Convolution Theorem\",\n      \"p\": \"represents\",\n      \"o\": \"bridge between time domain and frequency domain\",\n      \"modalities\": [\"text\"],\n      \"confidence\": 1.0,\n      \"evidence\": \"This theorem creates a beautiful bridge between two worlds â€” the time domain and the frequency domain.\"\n    },\n    {\n      \"s\": \"Convolution in the time domain\",\n      \"p\": \"becomes\",\n      \"o\": \"multiplication in the frequency domain\",\n      \"modalities\": [\"text\"],\n      \"confidence\": 1.0,\n      \"evidence\": \"Convolution in the time domain becomes multiplication in the frequency domain.\"\n    },\n    {\n      \"s\": \"Fourier transform of the convolution\",\n      \"p\": \"equals\",\n      \"o\": \"product of the individual Fourier transforms\",\n      \"modalities\": [\"text\"],\n      \"confidence\": 1.0,\n      \"evidence\": \"The Fourier transform of the convolution equals the product of the individual Fourier transforms.\"\n    },\n    {\n      \"s\": \"convolution of two rectangular functions\",\n      \"p\": \"produces\",\n      \"o",
  "parsed": {
    "s": "Fourier transform of the convolution",
    "p": "equals",
    "o": "product of the individual Fourier transforms",
    "modalities": [
      "text"
    ],
    "confidence": 1.0,
    "evidence": [
      "The Fourier transform of the convolution equals the product of the individual Fourier transforms."
    ]
  }
}