{
  "slide_id": "Slide29",
  "model": "OpenGVLab/InternVL3-14B",
  "prompt": "triples",
  "raw_output": "```json\n{\n  \"triples\": [\n    {\n      \"s\": \"lecture\",\n      \"p\": \"covers\",\n      \"o\": \"discrete convolution\",\n      \"modalities\": [\"text\"],\n      \"confidence\": 1.0,\n      \"evidence\": \"We’ve covered quite a lot — from discrete convolution and zero-padding, to spectral analysis, bin refinement, and practical applications in two-dimensional image filtering.\"\n    },\n    {\n      \"s\": \"lecture\",\n      \"p\": \"covers\",\n      \"o\": \"zero-padding\",\n      \"modalities\": [\"text\"],\n      \"confidence\": 1.0,\n      \"evidence\": \"We’ve covered quite a lot — from discrete convolution and zero-padding, to spectral analysis, bin refinement, and practical applications in two-dimensional image filtering.\"\n    },\n    {\n      \"s\": \"lecture\",\n      \"p\": \"covers\",\n      \"o\": \"spectral analysis\",\n      \"modalities\": [\"text\"],\n      \"confidence\": 1.0,\n      \"evidence\": \"We’ve covered quite a lot — from discrete convolution and zero-padding, to spectral analysis, bin refinement, and practical applications in two-dimensional image filtering.\"\n    },\n    {\n      \"s\": \"",
  "parsed": {
    "s": "lecture",
    "p": "covers",
    "o": "spectral analysis",
    "modalities": [
      "text"
    ],
    "confidence": 1.0,
    "evidence": [
      "We’ve covered quite a lot - from discrete convolution and zero-padding, to spectral analysis, bin refinement, and practical applications in two-dimensional image filtering."
    ]
  }
}