{
  "slide_id": "Slide1",
  "model": "OpenGVLab/InternVL3-14B",
  "prompt": "triples",
  "raw_output": "```json\n{\n  \"triples\": [\n    {\n      \"s\": \"MATLAB tutorial\",\n      \"p\": \"depends_on\",\n      \"o\": \"linear systems\",\n      \"modalities\": [\"text\"],\n      \"confidence\": 0.9,\n      \"evidence\": \"Over the past lectures, we’ve covered some very important foundations — linear systems, convolution, the delta function, Fourier series, Fourier transforms, and the sampling theorem.\"\n    },\n    {\n      \"s\": \"MATLAB tutorial\",\n      \"p\": \"depends_on\",\n      \"o\": \"convolution\",\n      \"modalities\": [\"text\"],\n      \"confidence\": 0.9,\n      \"evidence\": \"Over the past lectures, we’ve covered some very important foundations — linear systems, convolution, the delta function, Fourier series, Fourier transforms, and the sampling theorem.\"\n    },\n    {\n      \"s\": \"MATLAB tutorial\",\n      \"p\": \"depends_on\",\n      \"o\": \"delta function\",\n      \"modalities\": [\"text\"],\n      \"confidence\": 0.9,\n      \"evidence\": \"Over the past lectures, we’ve covered some very important foundations — linear systems, convolution, the delta function, Fourier series, Fourier",
  "parsed": {
    "s": "MATLAB tutorial",
    "p": "depends_on",
    "o": "convolution",
    "modalities": [
      "text"
    ],
    "confidence": 0.9,
    "evidence": [
      "Over the past lectures, we’ve covered some very important foundations - linear systems, convolution, the delta function, Fourier series, Fourier transforms, and the sampling theorem."
    ]
  }
}