{
  "slide_id": "Slide29",
  "model": "OpenGVLab/InternVL3-14B",
  "prompt": "triples",
  "raw_output": "```json\n{\n  \"triples\": [\n    {\n      \"s\": \"FFT\",\n      \"p\": \"uses\",\n      \"o\": \"discrete Fourier transform\",\n      \"modalities\": [\"text\"],\n      \"confidence\": 1.0,\n      \"evidence\": \"Fast Fourier Transform (FFT) is an efficient algorithm for performing a discrete Fourier transform\"\n    },\n    {\n      \"s\": \"FFT\",\n      \"p\": \"published by\",\n      \"o\": \"Cooley & Tukey\",\n      \"modalities\": [\"text\"],\n      \"confidence\": 1.0,\n      \"evidence\": \"FFT published by Cooley & Tukey in 1965\"\n    },\n    {\n      \"s\": \"FFT\",\n      \"p\": \"reconstructs_with\",\n      \"o\": \"real-time results\",\n      \"modalities\": [\"text\"],\n      \"confidence\": 1.0,\n      \"evidence\": \"This kind of speedup is critical in many applications, especially those that need real-time results\"\n    },\n    {\n      \"s\": \"FFT\",\n      \"p\": \"depends_on\",\n      \"o\": \"N times log-base-2 of N operations\",\n      \"modalities\": [\"",
  "parsed": {
    "s": "FFT",
    "p": "reconstructs_with",
    "o": "real-time results",
    "modalities": [
      "text"
    ],
    "confidence": 1.0,
    "evidence": [
      "This kind of speedup is critical in many applications, especially those that need real-time results"
    ]
  }
}