{
  "slide_id": "Slide1",
  "model": "OpenGVLab/InternVL3-14B",
  "prompt": "triples",
  "raw_output": "```json\n{\n  \"triples\": [\n    {\n      \"s\": \"Fourier analysis\",\n      \"p\": \"uses\",\n      \"o\": \"discrete Fourier transform\",\n      \"modalities\": [\"text\"],\n      \"confidence\": 1.0,\n      \"evidence\": \"Fourier analysis is central to all of these areas. We’ll use it to analyze and process signals in both continuous and discrete forms, and to move back and forth between the time or spatial domain and the frequency domain, in either a continuous or discrete form.\"\n    },\n    {\n      \"s\": \"Fourier analysis\",\n      \"p\": \"uses\",\n      \"o\": \"inverse Fourier transform\",\n      \"modalities\": [\"text\"],\n      \"confidence\": 1.0,\n      \"evidence\": \"Fourier analysis is central to all of these areas. We’ll use it to analyze and process signals in both continuous and discrete forms, and to move back and forth between the time or spatial domain and the frequency domain, in either a continuous or discrete form.\"\n    },\n    {\n      \"s\": \"lecture\",\n      \"p\": \"focuses on\",\n      \"o\": \"discrete Fourier transform\",\n      \"modalities\": [\"text\"],",
  "parsed": {
    "s": "Fourier analysis",
    "p": "uses",
    "o": "inverse Fourier transform",
    "modalities": [
      "text"
    ],
    "confidence": 1.0,
    "evidence": [
      "Fourier analysis is central to all of these areas. We’ll use it to analyze and process signals in both continuous and discrete forms, and to move back and forth between the time or spatial domain and the frequency domain, in either a continuous or discrete form."
    ]
  }
}