{
  "slide_id": "Slide18",
  "model": "OpenGVLab/InternVL3-14B",
  "prompt": "triples",
  "raw_output": "```json\n{\n  \"triples\": [\n    {\n      \"s\": \"Optical Coherence Tomography\",\n      \"p\": \"uses\",\n      \"o\": \"interference\",\n      \"modalities\": [\"text\"],\n      \"confidence\": 1.0,\n      \"evidence\": \"Here, we treat light as a wave — a coherent electromagnetic wave, like a laser beam. This shift in perspective is key. Because once you treat light as a wave, you can use interference — the way waves combine when they meet — to extract incredibly fine details about the structure of the tissue.\"\n    },\n    {\n      \"s\": \"Optical Coherence Tomography\",\n      \"p\": \"measures\",\n      \"o\": \"distance and structure\",\n      \"modalities\": [\"text\"],\n      \"confidence\": 1.0,\n      \"evidence\": \"This coherence-based approach allows OCT to perform precision measurements of distance and structure on the order of micrometers — even smaller than the wavelength of light itself.\"\n    },\n    {\n      \"s\": \"Optical Coherence Tomography\",\n      \"p\": \"reconstructs_with\",\n      \"o\": \"3D images\",\n      \"modalities\": [\"text\"],\n      \"confidence\":",
  "parsed": {
    "s": "Optical Coherence Tomography",
    "p": "measures",
    "o": "distance and structure",
    "modalities": [
      "text"
    ],
    "confidence": 1.0,
    "evidence": [
      "This coherence-based approach allows OCT to perform precision measurements of distance and structure on the order of micrometers - even smaller than the wavelength of light itself."
    ]
  }
}