{
  "slide_id": "Slide38",
  "model": "OpenGVLab/InternVL3-14B",
  "prompt": "triples",
  "raw_output": "```json\n{\n  \"triples\": [\n    {\n      \"s\": \"project\",\n      \"p\": \"uses\",\n      \"o\": \"optical molecular tomography\",\n      \"modalities\": [\"text\"],\n      \"confidence\": 1.0,\n      \"evidence\": \"a multi-million-dollar project — was about using optical molecular tomography to monitor blood vessel growth.\"\n    },\n    {\n      \"s\": \"project\",\n      \"p\": \"uses\",\n      \"o\": \"OCT\",\n      \"modalities\": [\"text\"],\n      \"confidence\": 1.0,\n      \"evidence\": \"We use OCT, or Optical Coherence Tomography, to capture the structural information\"\n    },\n    {\n      \"s\": \"project\",\n      \"p\": \"uses\",\n      \"o\": \"fluorescence imaging\",\n      \"modalities\": [\"text\"],\n      \"confidence\": 1.0,\n      \"evidence\": \"Then we combine that with fluorescence imaging to observe what’s happening at the cellular and molecular level.\"\n    },\n    {\n      \"s\": \"project\",\n      \"p\": \"uses\",\n      \"o\": \"diffuse optical tomography\",\n      \"modalities\": [\"text\"],\n      \"confidence\":",
  "parsed": {
    "s": "project",
    "p": "uses",
    "o": "fluorescence imaging",
    "modalities": [
      "text"
    ],
    "confidence": 1.0,
    "evidence": [
      "Then we combine that with fluorescence imaging to observe what’s happening at the cellular and molecular level."
    ]
  }
}