{
  "slide_id": "Slide30",
  "model": "OpenGVLab/InternVL3-14B",
  "prompt": "triples",
  "raw_output": "```json\n{\n  \"triples\": [\n    {\n      \"s\": \"Cardiac CT Architecture\",\n      \"p\": \"uses\",\n      \"o\": \"Best Conventional CT\",\n      \"modalities\": [\"text\"],\n      \"confidence\": 1.0,\n      \"evidence\": \"Background from Best Conventional CT\"\n    },\n    {\n      \"s\": \"Cardiac CT Architecture\",\n      \"p\": \"uses\",\n      \"o\": \"Spectral Interior Tomography\",\n      \"modalities\": [\"text\"],\n      \"confidence\": 1.0,\n      \"evidence\": \"ROI Info from Spectral Interior Tomography\"\n    },\n    {\n      \"s\": \"In-vivo Spectral Micro-CT\",\n      \"p\": \"enabled with\",\n      \"o\": \"Parallel Localized Data Acquisition\",\n      \"modalities\": [\"text\"],\n      \"confidence\": 1.0,\n      \"evidence\": \"In-vivo Spectral Micro-CT Enabled with Parallel Localized Data Acquisition\"\n    },\n    {\n      \"s\": \"In-vivo Spectral Micro-CT\",\n      \"p\": \"enabled with\",\n      \"o\": \"Hybrid Advanced Reconstruction\",\n      \"modalities\": [\"text\"],\n      \"confidence",
  "parsed": {
    "s": "In-vivo Spectral Micro-CT",
    "p": "enabled with",
    "o": "Parallel Localized Data Acquisition",
    "modalities": [
      "text"
    ],
    "confidence": 1.0,
    "evidence": [
      "In-vivo Spectral Micro-CT Enabled with Parallel Localized Data Acquisition"
    ]
  }
}