{
  "slide_id": "Slide20",
  "model": "OpenGVLab/InternVL3-14B",
  "prompt": "triples",
  "raw_output": "```json\n{\n  \"triples\": [\n    {\n      \"s\": \"helical cone beam scanning\",\n      \"p\": \"uses\",\n      \"o\": \"slip ring transmission\",\n      \"modalities\": [\"text\"],\n      \"confidence\": 1.0,\n      \"evidence\": \"Helical scanning combines multiple technologies, including slip ring transmission, X-ray sources, and sophisticated reconstruction algorithms.\"\n    },\n    {\n      \"s\": \"helical cone beam scanning\",\n      \"p\": \"uses\",\n      \"o\": \"X-ray sources\",\n      \"modalities\": [\"text\"],\n      \"confidence\": 1.0,\n      \"evidence\": \"Helical scanning combines multiple technologies, including slip ring transmission, X-ray sources, and sophisticated reconstruction algorithms.\"\n    },\n    {\n      \"s\": \"helical cone beam scanning\",\n      \"p\": \"reconstructs_with\",\n      \"o\": \"sophisticated reconstruction algorithms\",\n      \"modalities\": [\"text\"],\n      \"confidence\": 1.0,\n      \"evidence\": \"Helical scanning combines multiple technologies, including slip ring transmission, X-ray sources, and sophisticated reconstruction algorithms.\"\n    },\n    {\n      \"s\": \"multi-slice cone beam helical",
  "parsed": {
    "s": "helical cone beam scanning",
    "p": "reconstructs_with",
    "o": "sophisticated reconstruction algorithms",
    "modalities": [
      "text"
    ],
    "confidence": 1.0,
    "evidence": [
      "Helical scanning combines multiple technologies, including slip ring transmission, X-ray sources, and sophisticated reconstruction algorithms."
    ]
  }
}