{
  "slide_id": "Slide29",
  "model": "OpenGVLab/InternVL3-14B",
  "prompt": "triples",
  "raw_output": "```json\n{\n  \"triples\": [\n    {\n      \"s\": \"RPI\",\n      \"p\": \"collaborates_with\",\n      \"o\": \"GE Global Research Center\",\n      \"modalities\": [\"text\"],\n      \"confidence\": 1.0,\n      \"evidence\": \"At RPI, we have collaborated with GE Global Research Center and with Bruno Diem and others to develop optimized architectures for dedicated cardiac CT scanners.\"\n    },\n    {\n      \"s\": \"RPI\",\n      \"p\": \"collaborates_with\",\n      \"o\": \"Bruno Diem\",\n      \"modalities\": [\"text\"],\n      \"confidence\": 1.0,\n      \"evidence\": \"At RPI, we have collaborated with GE Global Research Center and with Bruno Diem and others to develop optimized architectures for dedicated cardiac CT scanners.\"\n    },\n    {\n      \"s\": \"RPI\",\n      \"p\": \"produces\",\n      \"o\": \"optimized architectures for dedicated cardiac CT scanners\",\n      \"modalities\": [\"text\"],\n      \"confidence\": 1.0,\n      \"evidence\": \"At RPI, we have collaborated with GE Global Research Center and with Bruno Diem and others to develop optimized architectures for",
  "parsed": {
    "s": "RPI",
    "p": "collaborates_with",
    "o": "Bruno Diem",
    "modalities": [
      "text"
    ],
    "confidence": 1.0,
    "evidence": [
      "At RPI, we have collaborated with GE Global Research Center and with Bruno Diem and others to develop optimized architectures for dedicated cardiac CT scanners."
    ]
  }
}