{
  "slide_id": "Slide3",
  "model": "OpenGVLab/InternVL3-14B",
  "prompt": "triples",
  "raw_output": "```json\n{\n  \"triples\": [\n    {\n      \"s\": \"Chapter Five\",\n      \"p\": \"measures\",\n      \"o\": \"image quality assessment\",\n      \"modalities\": [\"text\"],\n      \"confidence\": 1.0,\n      \"evidence\": \"The reason is simple: once you understand the basics of image quality assessment, you can apply these ideas to almost any imaging modality.\"\n    },\n    {\n      \"s\": \"Chapter Five\",\n      \"p\": \"measures\",\n      \"o\": \"resolution\",\n      \"modalities\": [\"text\"],\n      \"confidence\": 1.0,\n      \"evidence\": \"Concepts such as resolution, signal-to-noise ratio, contrast-to-noise ratio, and artifacts are universal.\"\n    },\n    {\n      \"s\": \"Chapter Five\",\n      \"p\": \"measures\",\n      \"o\": \"signal-to-noise ratio\",\n      \"modalities\": [\"text\"],\n      \"confidence\": 1.0,\n      \"evidence\": \"Concepts such as resolution, signal-to-noise ratio, contrast-to-noise ratio, and artifacts are universal.\"\n    },\n    {\n      \"s\": \"Chapter Five\",\n      \"p\": \"measures",
  "parsed": {
    "s": "Chapter Five",
    "p": "measures",
    "o": "signal-to-noise ratio",
    "modalities": [
      "text"
    ],
    "confidence": 1.0,
    "evidence": [
      "Concepts such as resolution, signal-to-noise ratio, contrast-to-noise ratio, and artifacts are universal."
    ]
  }
}