{
  "slide_id": "Slide4",
  "model": "OpenGVLab/InternVL3-14B",
  "prompt": "triples",
  "raw_output": "```json\n{\n  \"triples\": [\n    {\"s\":\"General Measures\", \"p\":\"measures\", \"o\":\"MSE\", \"modalities\":[\"text\"], \"confidence\":1.0, \"evidence\":\"MSE\"},\n    {\"s\":\"General Measures\", \"p\":\"measures\", \"o\":\"KL Distance\", \"modalities\":[\"text\"], \"confidence\":1.0, \"evidence\":\"KL Distance\"},\n    {\"s\":\"General Measures\", \"p\":\"measures\", \"o\":\"SSIM\", \"modalities\":[\"text\"], \"confidence\":1.0, \"evidence\":\"SSIM\"},\n    {\"s\":\"System Specific\", \"p\":\"measures\", \"o\":\"Noise, SNR & CNR\", \"modalities\":[\"text\"], \"confidence\":1.0, \"evidence\":\"Noise, SNR & CNR\"},\n    {\"s\":\"System Specific\", \"p\":\"measures\", \"o\":\"Resolution (Spatial, Contrast, Temporal, Spectral)\", \"modalities\":[\"text\"], \"confidence\":1.0, \"evidence\":\"Resolution (Spatial, Contrast, Temporal, Spectral)\"},\n    {\"s\":\"System Specific\", \"p\":\"measures\", \"o\":\"Artifacts\", \"modalities\":[\"",
  "parsed": {
    "s": "System Specific",
    "p": "measures",
    "o": "Resolution (Spatial, Contrast, Temporal, Spectral)",
    "modalities": [
      "text"
    ],
    "confidence": 1.0,
    "evidence": [
      "Resolution (Spatial, Contrast, Temporal, Spectral)"
    ]
  }
}