{
  "slide_id": "Slide9",
  "model": "OpenGVLab/InternVL3-14B",
  "prompt": "triples",
  "raw_output": "```json\n{\n  \"triples\": [\n    {\n      \"s\": \"Fourier transform\",\n      \"p\": \"produces\",\n      \"o\": \"signal processing\",\n      \"modalities\": [\"text\"],\n      \"confidence\": 1.0,\n      \"evidence\": \"Then, in Section 2, we’ll explore some of the most important properties of the Fourier transform. These properties aren’t just mathematical curiosities — they’re practical tools used in signal processing, imaging, and many other fields.\"\n    },\n    {\n      \"s\": \"Fourier transform\",\n      \"p\": \"produces\",\n      \"o\": \"imaging\",\n      \"modalities\": [\"text\"],\n      \"confidence\": 1.0,\n      \"evidence\": \"Then, in Section 2, we’ll explore some of the most important properties of the Fourier transform. These properties aren’t just mathematical curiosities — they’re practical tools used in signal processing, imaging, and many other fields.\"\n    },\n    {\n      \"s\": \"Fourier transform\",\n      \"p\": \"produces\",\n      \"o\": \"medical imaging\",\n      \"modalities\": [\"text\"],\n      \"confidence\": 1.0,\n      \"evidence",
  "parsed": {
    "s": "Fourier transform",
    "p": "produces",
    "o": "imaging",
    "modalities": [
      "text"
    ],
    "confidence": 1.0,
    "evidence": [
      "Then, in Section 2, we’ll explore some of the most important properties of the Fourier transform. These properties aren’t just mathematical curiosities - they’re practical tools used in signal processing, imaging, and many other fields."
    ]
  }
}