{
  "slide_id": "Slide23",
  "model": "OpenGVLab/InternVL3-14B",
  "prompt": "triples",
  "raw_output": "```json\n{\n  \"triples\": [\n    {\n      \"s\": \"Fourier transform\",\n      \"p\": \"represents\",\n      \"o\": \"linearity\",\n      \"modalities\": [\"text\"],\n      \"confidence\": 1.0,\n      \"evidence\": \"We begin with linearity.\"\n    },\n    {\n      \"s\": \"Fourier transform\",\n      \"p\": \"represents\",\n      \"o\": \"time-shifting property\",\n      \"modalities\": [\"text\"],\n      \"confidence\": 1.0,\n      \"evidence\": \"Next is the time-shifting property.\"\n    },\n    {\n      \"s\": \"Fourier transform\",\n      \"p\": \"represents\",\n      \"o\": \"modulation\",\n      \"modalities\": [\"text\"],\n      \"confidence\": 1.0,\n      \"evidence\": \"Now let’s flip that idea — this is called modulation.\"\n    },\n    {\n      \"s\": \"Fourier transform\",\n      \"p\": \"represents\",\n      \"o\": \"scaling\",\n      \"modalities\": [\"text\"],\n      \"confidence\": 1.0,\n      \"evidence\": \"Another important concept is scaling.\"\n    },\n    {\n      \"s",
  "parsed": {
    "s": "Fourier transform",
    "p": "represents",
    "o": "scaling",
    "modalities": [
      "text"
    ],
    "confidence": 1.0,
    "evidence": [
      "Another important concept is scaling."
    ]
  }
}