{
  "slide_id": "Slide29",
  "model": "OpenGVLab/InternVL3-14B",
  "prompt": "triples",
  "raw_output": "```json\n{\n  \"triples\": [\n    {\n      \"s\": \"nuclear reactor\",\n      \"p\": \"produces\",\n      \"o\": \"heat\",\n      \"modalities\": [\"text\"],\n      \"confidence\": 1.0,\n      \"evidence\": \"A nuclear reactor is essentially a device that initiates and controls a sustained chain reaction. In a typical power plant, this chain reaction produces heat\"\n    },\n    {\n      \"s\": \"nuclear reactor\",\n      \"p\": \"produces\",\n      \"o\": \"radionuclides\",\n      \"modalities\": [\"text\"],\n      \"confidence\": 1.0,\n      \"evidence\": \"they are used to produce radionuclides\"\n    },\n    {\n      \"s\": \"neutron capture\",\n      \"p\": \"produces\",\n      \"o\": \"useful isotope\",\n      \"modalities\": [\"text\"],\n      \"confidence\": 1.0,\n      \"evidence\": \"In neutron capture, a nucleus absorbs an extra neutron and becomes unstable, creating a useful isotope\"\n    },\n    {\n      \"s\": \"nuclear fission\",\n      \"p\": \"produces\",\n      \"o\": \"med",
  "parsed": {
    "s": "neutron capture",
    "p": "produces",
    "o": "useful isotope",
    "modalities": [
      "text"
    ],
    "confidence": 1.0,
    "evidence": [
      "In neutron capture, a nucleus absorbs an extra neutron and becomes unstable, creating a useful isotope"
    ]
  }
}