{
  "slide_id": "Slide1",
  "model": "OpenGVLab/InternVL3-14B",
  "prompt": "triples",
  "raw_output": "```json\n{\n  \"triples\": [\n    {\n      \"s\": \"MRI\",\n      \"p\": \"represents\",\n      \"o\": \"physical principles\",\n      \"modalities\": [\"text\"],\n      \"confidence\": 1.0,\n      \"evidence\": \"Today, we’re going to begin a new chapter on the physical principles of Magnetic Resonance Imaging, or MRI.\"\n    },\n    {\n      \"s\": \"MRI\",\n      \"p\": \"depends_on\",\n      \"o\": \"Maxwell’s equations\",\n      \"modalities\": [\"text\"],\n      \"confidence\": 1.0,\n      \"evidence\": \"We’ll build up from the physical foundations including Maxwell’s equations\"\n    },\n    {\n      \"s\": \"MRI\",\n      \"p\": \"depends_on\",\n      \"o\": \"magnetization\",\n      \"modalities\": [\"text\"],\n      \"confidence\": 1.0,\n      \"evidence\": \"through the concepts of magnetization\"\n    },\n    {\n      \"s\": \"MRI\",\n      \"p\": \"depends_on\",\n      \"o\": \"precession\",\n      \"modalities\": [\"text\"],\n      \"confidence\": 1.0,\n      \"evidence\": \"through",
  "parsed": {
    "s": "MRI",
    "p": "depends_on",
    "o": "magnetization",
    "modalities": [
      "text"
    ],
    "confidence": 1.0,
    "evidence": [
      "through the concepts of magnetization"
    ]
  }
}