{
  "slide_id": "Slide8",
  "model": "OpenGVLab/InternVL3-14B",
  "prompt": "triples",
  "raw_output": "```json\n{\n  \"triples\": [\n    {\n      \"s\": \"nominal formula\",\n      \"p\": \"uses\",\n      \"o\": \"probability stake\",\n      \"modalities\": [\"text\"],\n      \"confidence\": 0.9,\n      \"evidence\": \"And by nominal formula, basically, you have a series of events. And for an easy event, it's a probability stake.\"\n    },\n    {\n      \"s\": \"nominal formula\",\n      \"p\": \"represents\",\n      \"o\": \"toast coin\",\n      \"modalities\": [\"text\"],\n      \"confidence\": 0.9,\n      \"evidence\": \"And say you're a toaster coin, and it's a certain probability P, and you see one result.\"\n    },\n    {\n      \"s\": \"nominal formula\",\n      \"p\": \"measures\",\n      \"o\": \"defective rate\",\n      \"modalities\": [\"text\"],\n      \"confidence\": 0.9,\n      \"evidence\": \"if you purchase 10 computers. And individually, you know the defective rate is 2%. If you buy 10 computers in a row, what's the chance you get to buy the computer, then you",
  "parsed": {
    "s": "nominal formula",
    "p": "represents",
    "o": "toast coin",
    "modalities": [
      "text"
    ],
    "confidence": 0.9,
    "evidence": [
      "And say you're a toaster coin, and it's a certain probability P, and you see one result."
    ]
  }
}