{
  "slide_id": "Slide1",
  "model": "OpenGVLab/InternVL3-14B",
  "prompt": "triples",
  "raw_output": "```json\n{\n  \"triples\": [\n    {\n      \"s\": \"SPECT\",\n      \"p\": \"represents\",\n      \"o\": \"Single Photon Emission Computed Tomography\",\n      \"modalities\": [\"text\"],\n      \"confidence\": 1.0,\n      \"evidence\": \"SPECT stands for Single Photon Emission Computed Tomography\"\n    },\n    {\n      \"s\": \"PET\",\n      \"p\": \"represents\",\n      \"o\": \"Positron Emission Tomography\",\n      \"modalities\": [\"text\"],\n      \"confidence\": 1.0,\n      \"evidence\": \"PET means Positron Emission Tomography\"\n    },\n    {\n      \"s\": \"SPECT\",\n      \"p\": \"uses\",\n      \"o\": \"specific tracers and detectors\",\n      \"modalities\": [\"text\"],\n      \"confidence\": 1.0,\n      \"evidence\": \"Both enable molecular imaging and are vital for diagnostics, functional evaluation. They use specific tracers and detectors\"\n    },\n    {\n      \"s\": \"PET\",\n      \"p\": \"uses\",\n      \"o\": \"specific tracers and detectors\",\n      \"modalities\": [\"text\"],\n      \"",
  "parsed": {
    "s": "SPECT",
    "p": "uses",
    "o": "specific tracers and detectors",
    "modalities": [
      "text"
    ],
    "confidence": 1.0,
    "evidence": [
      "Both enable molecular imaging and are vital for diagnostics, functional evaluation. They use specific tracers and detectors"
    ]
  }
}