{
  "slide_id": "Slide50",
  "model": "OpenGVLab/InternVL3-14B",
  "prompt": "triples",
  "raw_output": "```json\n{\n  \"triples\": [\n    {\n      \"s\": \"Fully3D 2017\",\n      \"p\": \"uses\",\n      \"o\": \"Xi’an, China\",\n      \"modalities\": [\"text\"],\n      \"confidence\": 1.0,\n      \"evidence\": \"So this is the website for the Fully3D 2017 meeting, which was held in Xi’an, China from June 18 to 23, 2017.\"\n    },\n    {\n      \"s\": \"Xi’an\",\n      \"p\": \"represents\",\n      \"o\": \"China’s oldest ancient capital\",\n      \"modalities\": [\"text\"],\n      \"confidence\": 1.0,\n      \"evidence\": \"Xi’an is the oldest ancient capital of China\"\n    },\n    {\n      \"s\": \"Xi’an\",\n      \"p\": \"represents\",\n      \"o\": \"the starting point of the Silk Road\",\n      \"modalities\": [\"text\"],\n      \"confidence\": 1.0,\n      \"evidence\": \"As the start of the Silk Road\"\n    },\n    {\n      \"s\": \"Xi’an\",\n      \"p\": \"represents\",",
  "parsed": {
    "s": "Xi’an",
    "p": "represents",
    "o": "the starting point of the Silk Road",
    "modalities": [
      "text"
    ],
    "confidence": 1.0,
    "evidence": [
      "As the start of the Silk Road"
    ]
  }
}