{
  "slide_id": "Slide45",
  "model": "OpenGVLab/InternVL3-14B",
  "prompt": "triples",
  "raw_output": "```json\n{\n  \"triples\": [\n    {\n      \"s\": \"Traditional teaching\",\n      \"p\": \"represents\",\n      \"o\": \"knowledge transfer\",\n      \"modalities\": [\"text\"],\n      \"confidence\": 1.0,\n      \"evidence\": \"Traditional teaching is often about knowledge transfer.\"\n    },\n    {\n      \"s\": \"Innovation\",\n      \"p\": \"depends_on\",\n      \"o\": \"understanding\",\n      \"modalities\": [\"text\"],\n      \"confidence\": 1.0,\n      \"evidence\": \"To reach that point, you have to truly understand whatâ€™s going on beneath the surface.\"\n    },\n    {\n      \"s\": \"Reviewing\",\n      \"p\": \"uses\",\n      \"o\": \"book/PPT/Solutions/Answers\",\n      \"modalities\": [\"text\"],\n      \"confidence\": 1.0,\n      \"evidence\": \"You can use the book, the slides, and the solutions.\"\n    },\n    {\n      \"s\": \"Reviewing\",\n      \"p\": \"produces\",\n      \"o\": \"problems/Ideas/Tools/Motives\",\n      \"modalities\": [\"text\"],\n      \"confidence\": 1.0,",
  "parsed": {
    "s": "Reviewing",
    "p": "uses",
    "o": "book/PPT/Solutions/Answers",
    "modalities": [
      "text"
    ],
    "confidence": 1.0,
    "evidence": [
      "You can use the book, the slides, and the solutions."
    ]
  }
}