{
  "slide_id": "Slide11",
  "model": "OpenGVLab/InternVL3-14B",
  "prompt": "triples",
  "raw_output": "```json\n{\n  \"triples\": [\n    {\n      \"s\": \"limiting process\",\n      \"p\": \"represents\",\n      \"o\": \"idealized impulse\",\n      \"modalities\": [\"text\"],\n      \"confidence\": 0.9,\n      \"evidence\": \"By applying the limiting process, we create a perfect, universal model of an impulse\"\n    },\n    {\n      \"s\": \"Dirac delta function\",\n      \"p\": \"depends_on\",\n      \"o\": \"limiting process\",\n      \"modalities\": [\"text\"],\n      \"confidence\": 0.9,\n      \"evidence\": \"weâ€™re doing something similar here with the Dirac delta function\"\n    },\n    {\n      \"s\": \"shape of delta function\",\n      \"p\": \"measures\",\n      \"o\": \"area under the curve\",\n      \"modalities\": [\"text\"],\n      \"confidence\": 0.9,\n      \"evidence\": \"What matters is the area under the curve, not how the curve looks\"\n    },\n    {\n      \"s\": \"measurement\",\n      \"p\": \"produces\",\n      \"o\": \"exact shape\",\n      \"modalities\": [\"text\"],\n      \"confidence\": 0",
  "parsed": {
    "s": "shape of delta function",
    "p": "measures",
    "o": "area under the curve",
    "modalities": [
      "text"
    ],
    "confidence": 0.9,
    "evidence": [
      "What matters is the area under the curve, not how the curve looks"
    ]
  }
}