{
  "slide_id": "Slide3",
  "model": "OpenGVLab/InternVL3-14B",
  "prompt": "triples",
  "raw_output": "```json\n{\n  \"triples\": [\n    {\n      \"s\": \"convolution\",\n      \"p\": \"depends_on\",\n      \"o\": \"shift-invariant linear system\",\n      \"modalities\": [\"text\"],\n      \"confidence\": 1.0,\n      \"evidence\": \"We’ll begin by revisiting shift-invariant linear systems\"\n    },\n    {\n      \"s\": \"convolution\",\n      \"p\": \"produces\",\n      \"o\": \"continuous convolution\",\n      \"modalities\": [\"text\"],\n      \"confidence\": 1.0,\n      \"evidence\": \"Then, we’ll move into two important formulations of convolution: continuous convolution\"\n    },\n    {\n      \"s\": \"convolution\",\n      \"p\": \"produces\",\n      \"o\": \"discrete convolution\",\n      \"modalities\": [\"text\"],\n      \"confidence\": 1.0,\n      \"evidence\": \"Then, we’ll move into two important formulations of convolution: discrete convolution\"\n    },\n    {\n      \"s\": \"medical imaging\",\n      \"p\": \"depends_on\",\n      \"o\": \"convolution\",\n      \"modalities\": [\"text\"],\n      \"confidence\": 1.0,\n      \"evidence",
  "parsed": {
    "s": "convolution",
    "p": "produces",
    "o": "discrete convolution",
    "modalities": [
      "text"
    ],
    "confidence": 1.0,
    "evidence": [
      "Then, we’ll move into two important formulations of convolution: discrete convolution"
    ]
  }
}