{
  "slide_id": "Slide45",
  "model": "OpenGVLab/InternVL3-14B",
  "prompt": "triples",
  "raw_output": "```json\n{\n  \"triples\": [\n    {\n      \"s\": \"MATLAB\",\n      \"p\": \"uses\",\n      \"o\": \"Fourier transforms\",\n      \"modalities\": [\"text\"],\n      \"confidence\": 0.9,\n      \"evidence\": \"Looking ahead, the next lecture will focus on building a solid foundation in MATLAB, which will be essential as we move into topics like Fourier transforms and linear systems.\"\n    },\n    {\n      \"s\": \"MATLAB\",\n      \"p\": \"uses\",\n      \"o\": \"linear systems\",\n      \"modalities\": [\"text\"],\n      \"confidence\": 0.9,\n      \"evidence\": \"Looking ahead, the next lecture will focus on building a solid foundation in MATLAB, which will be essential as we move into topics like Fourier transforms and linear systems.\"\n    },\n    {\n      \"s\": \"MATLAB\",\n      \"p\": \"uses\",\n      \"o\": \"medical imaging\",\n      \"modalities\": [\"text\"],\n      \"confidence\": 0.9,\n      \"evidence\": \"MATLAB is an invaluable tool used across many disciplines; for example, medical imaging and biomedical engineering in general.\"\n    },\n    {\n      \"s\": \"MATLAB",
  "parsed": {
    "s": "MATLAB",
    "p": "uses",
    "o": "medical imaging",
    "modalities": [
      "text"
    ],
    "confidence": 0.9,
    "evidence": [
      "MATLAB is an invaluable tool used across many disciplines; for example, medical imaging and biomedical engineering in general."
    ]
  }
}