{
  "slide_id": "Slide35",
  "model": "OpenGVLab/InternVL3-14B",
  "prompt": "triples",
  "raw_output": "```json\n{\n  \"triples\": [\n    {\n      \"s\": \"Stanford University\",\n      \"p\": \"offers\",\n      \"o\": \"EE261: The Fourier Transform and Its Applications\",\n      \"modalities\": [\"text\"],\n      \"confidence\": 1.0,\n      \"evidence\": \"Stanford University offers an excellent course titled 'EE261: The Fourier Transform and Its Applications'.\"\n    },\n    {\n      \"s\": \"EE261: The Fourier Transform and Its Applications\",\n      \"p\": \"taught by\",\n      \"o\": \"Professor Brad Osgood\",\n      \"modalities\": [\"text\"],\n      \"confidence\": 1.0,\n      \"evidence\": \"It’s taught by Professor Brad Osgood\"\n    },\n    {\n      \"s\": \"EE261: The Fourier Transform and Its Applications\",\n      \"p\": \"available via\",\n      \"o\": \"Stanford’s SEE platform\",\n      \"modalities\": [\"text\"],\n      \"confidence\": 1.0,\n      \"evidence\": \"it is freely available online through Stanford’s SEE platform\"\n    },\n    {\n      \"s\": \"EE261: The Fourier Transform and",
  "parsed": {
    "s": "EE261: The Fourier Transform and Its Applications",
    "p": "available via",
    "o": "Stanford’s SEE platform",
    "modalities": [
      "text"
    ],
    "confidence": 1.0,
    "evidence": [
      "it is freely available online through Stanford’s SEE platform"
    ]
  }
}