{
  "slide_id": "Slide3",
  "model": "OpenGVLab/InternVL3-14B",
  "prompt": "triples",
  "raw_output": "```json\n{\n  \"triples\": [\n    {\n      \"s\": \"medical imaging\",\n      \"p\": \"represents\",\n      \"o\": \"methods, technologies and systems that help us see inside the human body, animals, or biological samples\",\n      \"modalities\": [\"text\"],\n      \"confidence\": 1.0,\n      \"evidence\": \"when we talk about medical imaging—sometimes we use the terms biomedical imaging or bio-instrumentation—we’re referring to a wide range of methods, technologies and systems that help us see inside the human body, animals, or biological samples.\"\n    },\n    {\n      \"s\": \"course\",\n      \"p\": \"uses\",\n      \"o\": \"MATLAB\",\n      \"modalities\": [\"text\"],\n      \"confidence\": 1.0,\n      \"evidence\": \"You’ll also get hands-on experience with tools like MATLAB\"\n    },\n    {\n      \"s\": \"course\",\n      \"p\": \"uses\",\n      \"o\": \"Books\",\n      \"modalities\": [\"text\"],\n      \"confidence\": 1.0,\n      \"evidence\": \"you’ll work with selected reading materials\"\n    },\n    {\n      \"s\": \"course\",\n      \"p\": \"",
  "parsed": {
    "s": "course",
    "p": "uses",
    "o": "Books",
    "modalities": [
      "text"
    ],
    "confidence": 1.0,
    "evidence": [
      "you’ll work with selected reading materials"
    ]
  }
}