{
  "slide_id": "Slide30",
  "model": "OpenGVLab/InternVL3-14B",
  "prompt": "triples",
  "raw_output": "```json\n{\n  \"triples\": [\n    {\n      \"s\": \"Imaging Program at RPI\",\n      \"p\": \"focuses on\",\n      \"o\": \"x-ray CT, optical molecular tomography, & AI-based imaging\",\n      \"modalities\": [\"text\"],\n      \"confidence\": 1.0,\n      \"evidence\": \"Focus on x-ray CT, optical molecular tomography, & AI-based imaging\"\n    },\n    {\n      \"s\": \"Imaging Program at RPI\",\n      \"p\": \"targets\",\n      \"o\": \"innovative & influential ideas\",\n      \"modalities\": [\"text\"],\n      \"confidence\": 1.0,\n      \"evidence\": \"Target innovative & influential ideas via world-class partnerships\"\n    },\n    {\n      \"s\": \"Imaging Program at RPI\",\n      \"p\": \"integrates\",\n      \"o\": \"theoretical, technical & biomedical aspects\",\n      \"modalities\": [\"text\"],\n      \"confidence\": 1.0,\n      \"evidence\": \"Integrate theoretical, technical & biomedical aspects for major applications\"\n    },\n    {\n      \"s\": \"Professor Xavier Intes\",\n      \"p\": \"is a leader in\",",
  "parsed": {
    "s": "Imaging Program at RPI",
    "p": "integrates",
    "o": "theoretical, technical & biomedical aspects",
    "modalities": [
      "text"
    ],
    "confidence": 1.0,
    "evidence": [
      "Integrate theoretical, technical & biomedical aspects for major applications"
    ]
  }
}