{
  "slide_id": "Slide21",
  "model": "OpenGVLab/InternVL3-14B",
  "prompt": "triples",
  "raw_output": "```json\n{\n  \"triples\": [\n    {\n      \"s\": \"ultrasound\",\n      \"p\": \"uses\",\n      \"o\": \"reflection\",\n      \"modalities\": [\"text\"],\n      \"confidence\": 1.0,\n      \"evidence\": \"Reflection happens because of impedance mismatch.\"\n    },\n    {\n      \"s\": \"ultrasound\",\n      \"p\": \"uses\",\n      \"o\": \"refraction\",\n      \"modalities\": [\"text\"],\n      \"confidence\": 1.0,\n      \"evidence\": \"So, remember this simple rule: reflection at a boundary means a change in direction.\"\n    },\n    {\n      \"s\": \"ultrasound\",\n      \"p\": \"uses\",\n      \"o\": \"scattering\",\n      \"modalities\": [\"text\"],\n      \"confidence\": 1.0,\n      \"evidence\": \"When ultrasound waves travel through tissue, they encounter many small structures — cells, organelles, connective fibers — that scatter energy in different directions.\"\n    },\n    {\n      \"s\": \"ultrasound\",\n      \"p\": \"uses\",\n      \"o\": \"absorption\",\n      \"modalities\": [\"text\"],\n      \"confidence\": 1.0,",
  "parsed": {
    "s": "ultrasound",
    "p": "uses",
    "o": "scattering",
    "modalities": [
      "text"
    ],
    "confidence": 1.0,
    "evidence": [
      "When ultrasound waves travel through tissue, they encounter many small structures - cells, organelles, connective fibers - that scatter energy in different directions."
    ]
  }
}