{
  "slide_id": "Slide4",
  "model": "OpenGVLab/InternVL3-14B",
  "prompt": "triples",
  "raw_output": "```json\n{\n  \"triples\": [\n    {\n      \"s\": \"Ultrasound imaging\",\n      \"p\": \"uses\",\n      \"o\": \"mechanical sound waves\",\n      \"modalities\": [\"text\"],\n      \"confidence\": 1.0,\n      \"evidence\": \"Ultrasound imaging has several clear advantages. First, it involves no ionizing radiation. Thatâ€™s very important because, unlike X-rays or gamma rays, ultrasound uses mechanical sound waves, not electromagnetic radiation.\"\n    },\n    {\n      \"s\": \"Ultrasound imaging\",\n      \"p\": \"measures\",\n      \"o\": \"interactions between biological soft tissues and ultrasound waves\",\n      \"modalities\": [\"text\"],\n      \"confidence\": 1.0,\n      \"evidence\": \"Measure interactions between biological soft tissues and ultrasound waves\"\n    },\n    {\n      \"s\": \"Ultrasound imaging\",\n      \"p\": \"produces\",\n      \"o\": \"images in real time\",\n      \"modalities\": [\"text\"],\n      \"confidence\": 1.0,\n      \"evidence\": \"Another major strength is speed. Ultrasound provides images in real time\"\n    },\n    {\n      \"s\": \"Ultrasound imaging\",\n      \"p\":",
  "parsed": {
    "s": "Ultrasound imaging",
    "p": "produces",
    "o": "images in real time",
    "modalities": [
      "text"
    ],
    "confidence": 1.0,
    "evidence": [
      "Another major strength is speed. Ultrasound provides images in real time"
    ]
  }
}