{
  "slide_id": "Slide19",
  "model": "OpenGVLab/InternVL3-14B",
  "prompt": "triples",
  "raw_output": "```json\n{\n  \"triples\": [\n    {\n      \"s\": \"acoustic impedance\",\n      \"p\": \"represents\",\n      \"o\": \"ratio of pressure to particle velocity\",\n      \"modalities\": [\"text\"],\n      \"confidence\": 1.0,\n      \"evidence\": \"A particularly important parameter in ultrasonic imaging is the characteristic acoustic impedance Z of tissue, which is defined as the ratio of the pressure to the particle velocity:\"\n    },\n    {\n      \"s\": \"acoustic impedance\",\n      \"p\": \"depends_on\",\n      \"o\": \"density and compressibility\",\n      \"modalities\": [\"text\"],\n      \"confidence\": 1.0,\n      \"evidence\": \"This shows that acoustic impedance depends on both density and compressibility, and it is a fundamental property of the material.\"\n    },\n    {\n      \"s\": \"acoustic impedance\",\n      \"p\": \"measures\",\n      \"o\": \"resistance to the passage of sound\",\n      \"modalities\": [\"text\"],\n      \"confidence\": 1.0,\n      \"evidence\": \"Because this ratio stays constant, we can define it as a characteristic property of the medium. This constant ratio is what we call acoustic impedance",
  "parsed": {
    "s": "acoustic impedance",
    "p": "depends_on",
    "o": "density and compressibility",
    "modalities": [
      "text"
    ],
    "confidence": 1.0,
    "evidence": [
      "This shows that acoustic impedance depends on both density and compressibility, and it is a fundamental property of the material."
    ]
  }
}