{
  "slide_id": "Slide38",
  "model": "OpenGVLab/InternVL3-14B",
  "prompt": "triples",
  "raw_output": "```json\n{\n  \"triples\": [\n    {\n      \"s\": \"MRI technology\",\n      \"p\": \"uses\",\n      \"o\": \"functional MRI\",\n      \"modalities\": [\"text\"],\n      \"confidence\": 1.0,\n      \"evidence\": \"how modern MRI technology can be used to study thought processes\"\n    },\n    {\n      \"s\": \"functional MRI\",\n      \"p\": \"measures\",\n      \"o\": \"brain activity patterns\",\n      \"modalities\": [\"text\"],\n      \"confidence\": 1.0,\n      \"evidence\": \"by monitoring brain activity patterns\"\n    },\n    {\n      \"s\": \"functional MRI\",\n      \"p\": \"detects\",\n      \"o\": \"what a person is recognizing or recalling\",\n      \"modalities\": [\"text\"],\n      \"confidence\": 1.0,\n      \"evidence\": \"we can detect what a person is recognizing or recalling\"\n    },\n    {\n      \"s\": \"brain's recognition centers\",\n      \"p\": \"light up\",\n      \"o\": \"subconscious memory traces\",\n      \"modalities\": [\"text\"],\n      \"confidence\": 1.0,\n      \"evidence\": \"the brainâ€™s recognition centers light",
  "parsed": {
    "s": "functional MRI",
    "p": "detects",
    "o": "what a person is recognizing or recalling",
    "modalities": [
      "text"
    ],
    "confidence": 1.0,
    "evidence": [
      "we can detect what a person is recognizing or recalling"
    ]
  }
}